{
  "$schema": "http://json-schema.org/draft-07/schema#",
  "title": "InvestmentEntities",
  "description": "Structured output from extract-investment-entities skill.",
  "type": "object",
  "required": ["schema_version", "generated_at", "status", "source", "coverage", "errors", "data"],
  "properties": {
    "schema_version": { "type": "string", "const": "1.0" },
    "generated_at": { "type": "string", "pattern": "^\\d{4}-\\d{2}-\\d{2}T\\d{2}:\\d{2}:\\d{2}[+-]\\d{2}:\\d{2}$" },
    "status": { "type": "string", "enum": ["complete", "partial", "failed"] },
    "source": {
      "type": "object",
      "required": ["skill", "commands"],
      "properties": {
        "skill": { "type": "string", "const": "extract-investment-entities" },
        "commands": { "type": "array", "items": { "type": "string" } }
      }
    },
    "coverage": {
      "type": "object",
      "required": ["requested", "succeeded", "failed"],
      "properties": {
        "requested": { "type": "integer", "minimum": 0 },
        "succeeded": { "type": "integer", "minimum": 0 },
        "failed": { "type": "integer", "minimum": 0 }
      }
    },
    "errors": { "type": "array", "items": { "type": "string" } },
    "data": {
      "type": "object",
      "properties": {
        "entities": {
          "type": "array",
          "items": {
            "type": "object",
            "required": ["name", "symbol", "market", "type", "confidence"],
            "properties": {
              "name": { "type": "string" },
              "symbol": { "type": "string" },
              "market": { "type": "string", "enum": ["a", "us", "hk", "index"] },
              "type": { "type": "string", "enum": ["stock", "sector", "index", "concept"] },
              "mentions": { "type": "integer" },
              "sources": { "type": "array", "items": { "type": "string" } },
              "confidence": { "type": "string", "enum": ["high", "medium", "low"] },
              "tendency": { "type": "string", "enum": ["bullish", "bearish", "neutral", "unknown"] }
            }
          }
        }
      }
    }
  }
}